order,variable,contemporaneous_assumption,economic_motivation
1,FEDFUNDS,Policy rate can contemporaneously affect all later variables in the recursive system.,"Monetary policy is a fast-moving financial/policy variable and Granger results show strong predictive content for inflation, unemployment, production, and money growth."
2,INF,Inflation reacts within the month to policy shocks but contemporaneously affects variables ordered after it.,"Prices are central to the policy objective; inflation shocks can affect real activity, money demand, and confidence with short delays."
3,UNRATE,"Labor-market conditions react contemporaneously to policy and inflation shocks, while affecting slower real and monetary aggregates in the same period.",Unemployment adjusts more slowly than financial variables but is a key state variable in Phillips-curve and business-cycle dynamics.
4,INDPRO_GROWTH,"Industrial production growth can react to policy, price, and labor-market shocks within the period.","Production is a real-activity measure that responds to demand, financing conditions, and labor-market slack."
5,M2_GROWTH,Money growth reacts contemporaneously to the variables ordered before it but does not contemporaneously move them under this identification.,"Broad money adjusts through banking, portfolio, and liquidity channels and is placed after policy and real-activity indicators."
6,SENTIMENT_CHANGE,Sentiment is allowed to react contemporaneously to all macro shocks ordered before it.,"Survey sentiment is fast-moving but often reflects news about policy, prices, labor markets, output, and liquidity; placing it last is conservative for macro shock interpretation."
